`smartctl` 是一个用于监控和诊断硬盘的 SMART（自监测、分析和报告技术）信息的命令行工具。
它提供了多种功能和选项，用于获取和分析硬盘的状态和性能信息。以下是 `smartctl` 工具的一些主要功能：

1. 显示硬盘基本信息：`smartctl` 可以显示硬盘的基本信息，包括设备型号、序列号、固件版本、接口类型等。

2. 显示硬盘 SMART 信息：`smartctl` 可以读取和显示硬盘的 SMART 信息，包括温度、健康状态、错误计数、剩余寿命预测等。这些信息可以帮助您了解硬盘的当前状态和健康状况。

3. 进行硬盘自检：`smartctl` 允许您执行硬盘的自检操作，包括短自检和长自检。这些自检操作可以帮助您检测硬盘是否存在问题或错误。

4. 显示硬盘的扇区和分区信息：`smartctl` 可以显示硬盘的扇区和分区信息，包括分区表类型、分区的起始和结束扇区、分区的文件系统类型等。

5. 进行硬盘功能测试：`smartctl` 提供了多种硬盘功能测试选项，包括读取测试、写入测试、随机读写测试等。这些功能测试可以帮助您评估硬盘的性能和可靠性。

6. 控制硬盘的高级功能：`smartctl` 允许您控制硬盘的一些高级功能，如禁用或启用 SMART 功能、设置硬盘休眠时间、设置硬盘自动保存功能等。

=============================================================
安装
apt install smartmontools

使用
sudo smartctrl -a /dev/sda

ID# ATTRIBUTE_NAME          
  1 Raw_Read_Error_Rate     硬盘读取数据时发生的原始读取错误的数量。
  3 Spin_Up_Time            硬盘启动时需要的时间。
  4 Start_Stop_Count        硬盘启动和停止的次数。
  5 Reallocated_Sector_Ct   已重新分配的扇区数量，表示硬盘上发现的坏扇区数量。
  7 Seek_Error_Rate         寻道操作中发生的错误的数量。
  9 Power_On_Hours          硬盘的累计通电时间，以小时为单位。
 10 Spin_Retry_Count        旋转重试计数。它表示硬盘在尝试启动或重新定位磁头时所需的旋转次数。
 12 Power_Cycle_Count       电源循环计数。它记录硬盘的电源循环次数，即硬盘被启动和关闭的次数。
183 Runtime_Bad_Block       运行时坏块计数。它表示在硬盘运行期间检测到的坏块数量。
184 End-to-End_Error        端到端错误。它指示硬盘在读取、校验或传输数据时发生的端到端错误数量。
187 Reported_Uncorrect      报告的无法纠正错误。它表示硬盘在读取或写入数据时无法纠正的错误数量。
188 Command_Timeout         命令超时。它记录硬盘在执行命令时发生的超时错误次数。
189 High_Fly_Writes         高飞写入。它表示硬盘在磁头接触到盘片之前的飞行高度上发生的写入操作次数。
190 Airflow_Temperature_Cel 空气流温度。它指示硬盘周围环境的温度，以摄氏度为单位。
193 Load_Cycle_Count        加载循环计数。它记录硬盘的加载/卸载循环次数，即硬盘停止/启动磁头的次数。
194 Temperature_Celsius     硬盘的温度，以摄氏度为单位。
195 Hardware_ECC_Recovered  硬盘使用硬件错误校正码（ECC）纠正的错误数量。
197 Current_Pending_Sector  当前等待重新分配的扇区数量。
198 Offline_Uncorrectable   离线状态下无法纠正的错误数量。
199 UDMA_CRC_Error_Count    在 Ultra DMA 传输中发生的 CRC 错误的数量。
240 Head_Flying_Hours       磁头飞行小时数。它表示硬盘磁头在飞行状态下的累计时间，以小时为单位。
241 Total_LBAs_Written      总写入逻辑块地址数。它记录硬盘上已写入的逻辑块地址总数。
242 Total_LBAs_Read         总读取逻辑块地址数。它记录硬盘上已读取的逻辑块地址总数。